2026-01-18 06:55:03 | INFO     | ================================================================================
2026-01-18 06:55:03 | INFO     | Logging initialized - Log file: D:\Hackathons\Auraverse2_P2\YML-Agentic-Orchestrator\engine\logs\workflow_20260118_065503.log
2026-01-18 06:55:03 | INFO     | ================================================================================
2026-01-18 06:55:03 | INFO     | ================================================================================
2026-01-18 06:55:03 | INFO     | WORKFLOW EXECUTION STARTED
2026-01-18 06:55:03 | INFO     | Start Time: 2026-01-18 06:55:03
2026-01-18 06:55:03 | INFO     | YAML File: D:\Hackathons\Auraverse2_P2\YML-Agentic-Orchestrator\engine\examples\config_sequential.yml
2026-01-18 06:55:03 | INFO     | ================================================================================
2026-01-18 06:55:03 | INFO     | Clearing context for fresh workflow start
2026-01-18 06:55:03 | DEBUG    | JSON context file reset: D:\Hackathons\Auraverse2_P2\YML-Agentic-Orchestrator\engine\context\raw.json
2026-01-18 06:55:03 | DEBUG    | RAG memory cleared
2026-01-18 06:55:03 | INFO     | Context cleared successfully in 0.002s
2026-01-18 06:55:03 | INFO     | Loading YAML configuration from: D:\Hackathons\Auraverse2_P2\YML-Agentic-Orchestrator\engine\examples\config_sequential.yml
2026-01-18 06:55:03 | INFO     | YAML loaded successfully in 0.00s
2026-01-18 06:55:03 | DEBUG    | Configuration contains 4 agents
2026-01-18 06:55:03 | DEBUG    | Workflow type: sequential
2026-01-18 06:55:03 | INFO     | Configuration Summary:
2026-01-18 06:55:03 | INFO     |   - Total Agents: 4
2026-01-18 06:55:03 | INFO     |   - Workflow Type: sequential
2026-01-18 06:55:03 | INFO     | ================================================================================
2026-01-18 06:55:03 | INFO     | EXECUTING SEQUENTIAL WORKFLOW
2026-01-18 06:55:03 | INFO     | ================================================================================
2026-01-18 06:55:03 | INFO     | Total steps in workflow: 4
2026-01-18 06:55:03 | DEBUG    | Step sequence: coordinator_agent_1 -> researcher_agent_1 -> analyst_agent_1 -> writer_agent_1
2026-01-18 06:55:03 | INFO     | 
================================================================================
2026-01-18 06:55:03 | INFO     | STEP 1/4: Processing agent 'coordinator_agent_1'
2026-01-18 06:55:03 | INFO     | ================================================================================
2026-01-18 06:55:03 | INFO     | Agent Role: Coordinator Agent
2026-01-18 06:55:03 | INFO     | Agent Goal: Coordinate multiple agents to produce a final high-quality result
2026-01-18 06:55:03 | INFO     | Model: default
2026-01-18 06:55:03 | DEBUG    | Prompt length: 317 chars
2026-01-18 06:55:03 | DEBUG    | Saving context for role: User (length: 317 chars)
2026-01-18 06:55:03 | DEBUG    | Saved to JSON backup: D:\Hackathons\Auraverse2_P2\YML-Agentic-Orchestrator\engine\context\raw.json
2026-01-18 06:55:03 | DEBUG    | Saved to RAG memory
2026-01-18 06:55:03 | DEBUG    | Context saved in 0.002s
2026-01-18 06:55:03 | INFO     | Sending request to default...
2026-01-18 06:55:04 | INFO     | Response received in 1.30s (201 chars)
2026-01-18 06:55:04 | INFO     | 
Coordinator Agent Response:
2026-01-18 06:55:04 | INFO     | ------------------------------------------------------------
2026-01-18 06:55:04 | INFO     | [Error calling Gemini: 404 models/default is not found for API version v1beta, or is not supported for generateContent. Call ListModels to see the list of available models and their supported methods.]
2026-01-18 06:55:04 | INFO     | ------------------------------------------------------------
2026-01-18 06:55:04 | DEBUG    | Saving context for role: Coordinator Agent (length: 201 chars)
2026-01-18 06:55:04 | DEBUG    | Saved to JSON backup: D:\Hackathons\Auraverse2_P2\YML-Agentic-Orchestrator\engine\context\raw.json
2026-01-18 06:55:04 | DEBUG    | Saved to RAG memory
2026-01-18 06:55:04 | DEBUG    | Context saved in 0.002s
2026-01-18 06:55:04 | INFO     | 
================================================================================
2026-01-18 06:55:04 | INFO     | STEP 2/4: Processing agent 'researcher_agent_1'
2026-01-18 06:55:04 | INFO     | ================================================================================
2026-01-18 06:55:04 | INFO     | Retrieving relevant context from previous steps (RAG)
2026-01-18 06:55:04 | DEBUG    | Retrieving relevant context (max: 5 memories)
2026-01-18 06:55:04 | DEBUG    | Retrieved 1805 chars of relevant context in 0.002s
2026-01-18 06:55:04 | INFO     | Agent Role: Research Assistant
2026-01-18 06:55:04 | INFO     | Agent Goal: Collect accurate and relevant information
2026-01-18 06:55:04 | INFO     | Model: gemini-2.5-flash
2026-01-18 06:55:04 | DEBUG    | Including context in prompt
2026-01-18 06:55:04 | DEBUG    | Prompt length: 1981 chars
2026-01-18 06:55:04 | DEBUG    | Saving context for role: User (length: 147 chars)
2026-01-18 06:55:04 | DEBUG    | Saved to JSON backup: D:\Hackathons\Auraverse2_P2\YML-Agentic-Orchestrator\engine\context\raw.json
2026-01-18 06:55:04 | DEBUG    | Saved to RAG memory
2026-01-18 06:55:04 | DEBUG    | Context saved in 0.001s
2026-01-18 06:55:04 | INFO     | Sending request to gemini-2.5-flash...
2026-01-18 06:55:14 | INFO     | Response received in 9.57s (170 chars)
2026-01-18 06:55:14 | INFO     | 
Research Assistant Response:
2026-01-18 06:55:14 | INFO     | ------------------------------------------------------------
2026-01-18 06:55:14 | INFO     | Please provide the specific topic you would like me to research. I am ready to collect accurate and relevant information and extract key insights once the topic is given.
2026-01-18 06:55:14 | INFO     | ------------------------------------------------------------
2026-01-18 06:55:14 | DEBUG    | Saving context for role: Research Assistant (length: 170 chars)
2026-01-18 06:55:14 | DEBUG    | Saved to JSON backup: D:\Hackathons\Auraverse2_P2\YML-Agentic-Orchestrator\engine\context\raw.json
2026-01-18 06:55:14 | DEBUG    | Saved to RAG memory
2026-01-18 06:55:14 | DEBUG    | Context saved in 0.002s
2026-01-18 06:55:14 | INFO     | 
================================================================================
2026-01-18 06:55:14 | INFO     | STEP 3/4: Processing agent 'analyst_agent_1'
2026-01-18 06:55:14 | INFO     | ================================================================================
2026-01-18 06:55:14 | INFO     | Retrieving relevant context from previous steps (RAG)
2026-01-18 06:55:14 | DEBUG    | Retrieving relevant context (max: 5 memories)
2026-01-18 06:55:14 | DEBUG    | Retrieved 1758 chars of relevant context in 0.001s
2026-01-18 06:55:14 | INFO     | Agent Role: Data Analyst
2026-01-18 06:55:14 | INFO     | Agent Goal: Analyze structured data and derive insights
2026-01-18 06:55:14 | INFO     | Model: gemini-2.5-flash
2026-01-18 06:55:14 | DEBUG    | Including context in prompt
2026-01-18 06:55:14 | DEBUG    | Prompt length: 1912 chars
2026-01-18 06:55:14 | DEBUG    | Saving context for role: User (length: 125 chars)
2026-01-18 06:55:14 | DEBUG    | Saved to JSON backup: D:\Hackathons\Auraverse2_P2\YML-Agentic-Orchestrator\engine\context\raw.json
2026-01-18 06:55:14 | DEBUG    | Saved to RAG memory
2026-01-18 06:55:14 | DEBUG    | Context saved in 0.002s
2026-01-18 06:55:14 | INFO     | Sending request to gemini-2.5-flash...
2026-01-18 06:55:17 | INFO     | Response received in 3.41s (273 chars)
2026-01-18 06:55:17 | INFO     | 
Data Analyst Response:
2026-01-18 06:55:17 | INFO     | ------------------------------------------------------------
2026-01-18 06:55:17 | INFO     | Data Analyst: I am the Data Analyst. My goal is to analyze structured data, derive insights, and summarize trends. I am ready to perform my function when structured data is provided for analysis. Currently, the Research Assistant is awaiting a specific topic from the user.
2026-01-18 06:55:17 | INFO     | ------------------------------------------------------------
2026-01-18 06:55:17 | DEBUG    | Saving context for role: Data Analyst (length: 273 chars)
2026-01-18 06:55:17 | DEBUG    | Saved to JSON backup: D:\Hackathons\Auraverse2_P2\YML-Agentic-Orchestrator\engine\context\raw.json
2026-01-18 06:55:17 | DEBUG    | Saved to RAG memory
2026-01-18 06:55:17 | DEBUG    | Context saved in 0.002s
2026-01-18 06:55:17 | INFO     | 
================================================================================
2026-01-18 06:55:17 | INFO     | STEP 4/4: Processing agent 'writer_agent_1'
2026-01-18 06:55:17 | INFO     | ================================================================================
2026-01-18 06:55:17 | INFO     | Retrieving relevant context from previous steps (RAG)
2026-01-18 06:55:17 | DEBUG    | Retrieving relevant context (max: 5 memories)
2026-01-18 06:55:17 | DEBUG    | Retrieved 989 chars of relevant context in 0.000s
2026-01-18 06:55:17 | INFO     | Agent Role: Content Writer
2026-01-18 06:55:17 | INFO     | Agent Goal: Write a concise and clear explanation
2026-01-18 06:55:17 | INFO     | Model: gemini-2.5-flash
2026-01-18 06:55:17 | DEBUG    | Including context in prompt
2026-01-18 06:55:17 | DEBUG    | Prompt length: 1144 chars
2026-01-18 06:55:17 | DEBUG    | Saving context for role: User (length: 126 chars)
2026-01-18 06:55:17 | DEBUG    | Saved to JSON backup: D:\Hackathons\Auraverse2_P2\YML-Agentic-Orchestrator\engine\context\raw.json
2026-01-18 06:55:17 | DEBUG    | Saved to RAG memory
2026-01-18 06:55:17 | DEBUG    | Context saved in 0.001s
2026-01-18 06:55:17 | INFO     | Sending request to gemini-2.5-flash...
2026-01-18 06:55:22 | INFO     | Response received in 4.19s (662 chars)
2026-01-18 06:55:22 | INFO     | 
Content Writer Response:
2026-01-18 06:55:22 | INFO     | ------------------------------------------------------------
2026-01-18 06:55:22 | INFO     | **Explanation:**
The system encountered a technical error where the Coordinator Agent failed to access the Gemini AI model due to a "404 Not Found" error for `models/default` or an unsupported `generateContent` method for the `v1beta` API version. Simultaneously, both the Research Assistant and Data Analyst agents are operational but are currently idle, awaiting specific input from the user—a research topic for the Research Assistant and structured data for the Data Analyst.

**Summary:**
The Coordinator Agent experienced an API error with the Gemini model, while the Research Assistant and Data Analyst agents are awaiting user input to begin their tasks.
2026-01-18 06:55:22 | INFO     | ------------------------------------------------------------
2026-01-18 06:55:22 | DEBUG    | Saving context for role: Content Writer (length: 662 chars)
2026-01-18 06:55:22 | DEBUG    | Saved to JSON backup: D:\Hackathons\Auraverse2_P2\YML-Agentic-Orchestrator\engine\context\raw.json
2026-01-18 06:55:22 | DEBUG    | Saved to RAG memory
2026-01-18 06:55:22 | DEBUG    | Context saved in 0.002s
2026-01-18 06:55:22 | INFO     | ================================================================================
2026-01-18 06:55:22 | INFO     | WORKFLOW EXECUTION COMPLETED SUCCESSFULLY
2026-01-18 06:55:22 | INFO     | End Time: 2026-01-18 06:55:22
2026-01-18 06:55:22 | INFO     | Total Duration: 18.51 seconds
2026-01-18 06:55:22 | INFO     | Context saved to: D:\Hackathons\Auraverse2_P2\YML-Agentic-Orchestrator\engine\context\raw.json
2026-01-18 06:55:22 | INFO     | Total memories in RAG: 0
2026-01-18 06:55:22 | INFO     | Log file: D:\Hackathons\Auraverse2_P2\YML-Agentic-Orchestrator\engine\logs\workflow_20260118_065503.log
2026-01-18 06:55:22 | INFO     | ================================================================================
